<?xml version="1.0" encoding="UTF-8"?>
<Map xmlns="http://jkt/map2017.xsd" xmlns:xsi="http://www.w3.org/2001/XMLSchema-instance" xsi:schemaLocation="http://jkt/map2017.xsd H:/jkt/git/moteur/sources/map2017.xsd">
    <Materiaux>
        <MateriauTexture Ref="id-1000">
            <Ambiante R="0.588" G="0.588" B="0.588"/>
            <Diffuse R="0.588" G="0.588" B="0.588"/>
            <Specular R="0.9" G="0.9" B="0.9"/>
            <Fichier Nom="$\Sand3.jpg"/>
        </MateriauTexture>
    </Materiaux>
    <Lights/>
    <Geos>
        <GeoTexture Ref="id-N65571" Nom="Plane01">
<Solide Valeur="true"/>
<Materiau Ref="id-1000"/>
<Sommets Nbr="6">
                <S X="5" Y="-1" Z="5"/>
                <S X="5" Y="-1" Z="-5"/>
                <S X="-5" Y="-1" Z="5"/>
                <S X="-5" Y="-1" Z="-5"/>
                <S X="-5" Y="-1" Z="5"/>
                <S X="5" Y="-1" Z="-5"/>
            </Sommets>
<VecteursNormaux Nbr="6">
                <S X="-0" Y="0" Z="1"/>
                <S X="-0" Y="0" Z="1"/>
                <S X="-0" Y="0" Z="1"/>
                <S X="-0" Y="0" Z="1"/>
                <S X="-0" Y="0" Z="1"/>
                <S X="-0" Y="0" Z="1"/>
            </VecteursNormaux>
<SommetsDeTexture Nbr="6">
                <S U="17.991" V="0.0085"/>
                <S U="0.009" V="0.0085"/>
                <S U="17.991" V="16.9915"/>
                <S U="0.009" V="16.9915"/>
                <S U="17.991" V="16.9915"/>
                <S U="0.009" V="0.0085"/>
            </SommetsDeTexture>
</GeoTexture>
    </Geos>
</Map>
